<?xml version="1.0" encoding="UTF-8"?>
<?xml-stylesheet href="events.xsl" type="text/xsl"?>
<!-- Event Management System XML Data -->
<!-- Contains 100 events, 109 participants, and 154+ registrations -->
<eventManagementSystem xmlns:xsi="http://www.w3.org/2001/XMLSchema-instance" xsi:noNamespaceSchemaLocation="events.xsd">
  
  <!-- Events Section: University events with organizer information -->
  <events>
    <event eventId="EVT-0001" eventStatus="upcoming">
      <eventName>AI and Machine Learning Workshop</eventName>
      <eventDate>2026-05-25</eventDate>
      <eventTime>09:00:00</eventTime>
      <venue>PLP Testing Room</venue>
      <capacity>100</capacity>
      <registrationCount>3</registrationCount>
      <category>Academic</category>
      <organizer>Dr. Ahmad Hassan</organizer>
      <description>A comprehensive workshop on artificial intelligence and machine learning concepts.</description>
    </event>
    <event eventId="EVT-0002" eventStatus="upcoming">
      <eventName>Philosophy and Critical Thinking Forum</eventName>
      <eventDate>2026-05-26</eventDate>
      <eventTime>10:00:00</eventTime>
      <venue>PLP Audio Visual Room</venue>
      <capacity>50</capacity>
      <registrationCount>1</registrationCount>
      <category>Academic</category>
      <organizer>Prof. Maria Santos</organizer>
      <description>A forum for discussing philosophical ideas and developing critical thinking skills.</description>
    </event>
    <event eventId="EVT-0003" eventStatus="upcoming">
      <eventName>Career Development and Resume Workshop</eventName>
      <eventDate>2026-05-27</eventDate>
      <eventTime>14:00:00</eventTime>
      <venue>Auditorium</venue>
      <capacity>50</capacity>
      <registrationCount>3</registrationCount>
      <category>Professional Development</category>
      <organizer>Mr. James Wilson</organizer>
      <description>A workshop on career planning and resume writing.</description>
    </event>
    <event eventId="EVT-0004" eventStatus="upcoming">
      <eventName>Entrepreneurship Workshop</eventName>
      <eventDate>2026-05-28</eventDate>
      <eventTime>15:00:00</eventTime>
      <venue>PLP Quadrangle</venue>
      <capacity>100</capacity>
      <registrationCount>2</registrationCount>
      <category>Professional Development</category>
      <organizer>Ms. Patricia Brown</organizer>
      <description>A workshop on entrepreneurship and business planning.</description>
    </event>
    <event eventId="EVT-0005" eventStatus="closed">
      <eventName>Cybersecurity Awareness Forum</eventName>
      <eventDate>2026-05-12</eventDate>
      <eventTime>11:00:00</eventTime>
      <venue>Gymnasium</venue>
      <capacity>50</capacity>
      <registrationCount>2</registrationCount>
      <category>Professional Development</category>
      <organizer>Mr. Robert Johnson</organizer>
      <description>A forum on cybersecurity awareness and best practices.</description>
    </event>
    <event eventId="EVT-0006" eventStatus="closed">
      <eventName>Entrepreneurship Workshop</eventName>
      <eventDate>2026-05-12</eventDate>
      <eventTime>16:00:00</eventTime>
      <venue>PLP Quadrangle</venue>
      <capacity>100</capacity>
      <registrationCount>2</registrationCount>
      <category>Professional Development</category>
      <organizer>Ms. Jennifer Davis</organizer>
      <description>A workshop on entrepreneurship and business planning.</description>
    </event>
    <event eventId="EVT-0007" eventStatus="current">
      <eventName>Data Science Bootcamp</eventName>
      <eventDate>2026-05-12</eventDate>
      <eventTime>09:00:00</eventTime>
      <venue>Auditorium</venue>
      <capacity>100</capacity>
      <registrationCount>2</registrationCount>
      <category>Academic</category>
      <organizer>Dr. Carlos Reyes</organizer>
      <description>A comprehensive workshop on data science fundamentals.</description>
    </event>
    <event eventId="EVT-0008" eventStatus="current">
      <eventName>Leadership and Communication Seminar</eventName>
      <eventDate>2026-05-12</eventDate>
      <eventTime>10:00:00</eventTime>
      <venue>Facade</venue>
      <capacity>150</capacity>
      <registrationCount>4</registrationCount>
      <category>Professional Development</category>
      <organizer>Mr. Michael Miller</organizer>
      <description>A seminar on effective leadership and communication skills.</description>
    </event>
    <event eventId="EVT-0009" eventStatus="current">
      <eventName>Digital Photography Workshop</eventName>
      <eventDate>2026-05-13</eventDate>
      <eventTime>14:00:00</eventTime>
      <venue>Banquet Hall</venue>
      <capacity>50</capacity>
      <registrationCount>2</registrationCount>
      <category>Professional Development</category>
      <organizer>Ms. Sarah Wilson</organizer>
      <description>A workshop on digital photography techniques and editing.</description>
    </event>
    <event eventId="EVT-0010" eventStatus="current">
      <eventName>Public Speaking and Debate Training</eventName>
      <eventDate>2026-05-14</eventDate>
      <eventTime>15:00:00</eventTime>
      <venue>PLP Quadrangle</venue>
      <capacity>100</capacity>
      <registrationCount>2</registrationCount>
      <category>Professional Development</category>
      <organizer>Mr. David Lee</organizer>
      <description>A training session on public speaking and debate skills.</description>
    </event>
    <event eventId="EVT-0011" eventStatus="upcoming">
      <eventName>Information Systems Planning Seminar</eventName>
      <eventDate>2026-05-15</eventDate>
      <eventTime>09:00:00</eventTime>
      <venue>Function Hall</venue>
      <capacity>80</capacity>
      <registrationCount>2</registrationCount>
      <category>Academic</category>
      <organizer>Prof. Anna Garcia</organizer>
      <description>A seminar on planning and managing information systems projects.</description>
    </event>
    <event eventId="EVT-0012" eventStatus="upcoming">
      <eventName>Cloud Computing Essentials</eventName>
      <eventDate>2026-06-01</eventDate>
      <eventTime>09:00:00</eventTime>
      <venue>PLP Testing Room</venue>
      <capacity>80</capacity>
      <registrationCount>2</registrationCount>
      <category>Academic</category>
      <organizer>Dr. Miguel Torres</organizer>
      <description>Learn cloud computing fundamentals and best practices.</description>
    </event>
    <event eventId="EVT-0013" eventStatus="upcoming">
      <eventName>Mobile App Development Bootcamp</eventName>
      <eventDate>2026-06-02</eventDate>
      <eventTime>10:00:00</eventTime>
      <venue>Gymnasium</venue>
      <capacity>60</capacity>
      <registrationCount>3</registrationCount>
      <category>Academic</category>
      <organizer>Prof. Sofia Morales</organizer>
      <description>Hands-on mobile app development using modern frameworks.</description>
    </event>
    <event eventId="EVT-0014" eventStatus="upcoming">
      <eventName>Web Design and UX Workshop</eventName>
      <eventDate>2026-06-03</eventDate>
      <eventTime>14:00:00</eventTime>
      <venue>Sports Development Office</venue>
      <capacity>40</capacity>
      <registrationCount>3</registrationCount>
      <category>Academic</category>
      <organizer>Dr. Luis Fernandez</organizer>
      <description>Learn modern web design and user experience principles.</description>
    </event>
    <event eventId="EVT-0015" eventStatus="upcoming">
      <eventName>Database Design and SQL Mastery</eventName>
      <eventDate>2026-06-04</eventDate>
      <eventTime>11:00:00</eventTime>
      <venue>Facade</venue>
      <capacity>50</capacity>
      <registrationCount>2</registrationCount>
      <category>Academic</category>
      <organizer>Prof. Rosa Jimenez</organizer>
      <description>Master database design patterns and advanced SQL techniques.</description>
    </event>
    <event eventId="EVT-0016" eventStatus="upcoming">
      <eventName>DevOps and CI/CD Pipeline</eventName>
      <eventDate>2026-06-05</eventDate>
      <eventTime>13:00:00</eventTime>
      <venue>Function Hall</venue>
      <capacity>35</capacity>
      <registrationCount>1</registrationCount>
      <category>Academic</category>
      <organizer>Dr. Pedro Sanchez</organizer>
      <description>Learn continuous integration and deployment best practices.</description>
    </event>
    <event eventId="EVT-0017" eventStatus="upcoming">
      <eventName>Data Privacy and Ethics Seminar</eventName>
      <eventDate>2026-06-06</eventDate>
      <eventTime>09:00:00</eventTime>
      <venue>PLP Testing Room</venue>
      <capacity>60</capacity>
      <registrationCount>1</registrationCount>
      <category>Academic</category>
      <organizer>Prof. Elena Rodriguez</organizer>
      <description>A seminar on data privacy principles, ethics, and responsible technology use.</description>
    </event>
    <event eventId="EVT-0018" eventStatus="upcoming">
      <eventName>Software Documentation Workshop</eventName>
      <eventDate>2026-06-07</eventDate>
      <eventTime>10:00:00</eventTime>
      <venue>PLP Audio Visual Room</venue>
      <capacity>45</capacity>
      <registrationCount>1</registrationCount>
      <category>Academic</category>
      <organizer>Dr. Ahmad Hassan</organizer>
      <description>Hands-on workshop for writing clear technical and user documentation.</description>
    </event>
    <event eventId="EVT-0019" eventStatus="upcoming">
      <eventName>Capstone Proposal Colloquium</eventName>
      <eventDate>2026-06-08</eventDate>
      <eventTime>14:00:00</eventTime>
      <venue>PLP Audio Visual Room</venue>
      <capacity>70</capacity>
      <registrationCount>1</registrationCount>
      <category>Academic</category>
      <organizer>Prof. Maria Santos</organizer>
      <description>Presentation and review of student capstone project proposals.</description>
    </event>